<?xml version="1.0"?>
<xs:schema xmlns:xs="http://www.w3.org/2001/XMLSchema">
	<xs:element name="list" type="listType" />
	<xs:complexType name="paramType">
		<xs:simpleContent>
			<xs:extension base="xs:string">
				<xs:attribute name="name" type="xs:string" use="required" />
			</xs:extension>
		</xs:simpleContent>
	</xs:complexType>
	<xs:complexType name="handlerType">
		<xs:sequence>
			<xs:element type="paramType" name="param" maxOccurs="unbounded" minOccurs="0" />
		</xs:sequence>
		<xs:attribute name="name" type="xs:string" use="required" />
	</xs:complexType>
	<xs:complexType name="itemType">
		<xs:simpleContent>
			<xs:extension base="xs:string">
				<xs:attribute type="xs:int" name="id" use="required" />
				<xs:attribute type="xs:int" name="count" use="required" />
			</xs:extension>
		</xs:simpleContent>
	</xs:complexType>
	<xs:complexType name="itemsType">
		<xs:sequence>
			<xs:element type="itemType" name="item" maxOccurs="unbounded" minOccurs="1" />
		</xs:sequence>
	</xs:complexType>
	<xs:complexType name="rewardType">
		<xs:sequence>
			<xs:element type="xs:short" name="classId" maxOccurs="unbounded" minOccurs="0" />
			<xs:element type="handlerType" name="handler" minOccurs="1" maxOccurs="1" />
			<xs:element type="itemsType" name="items" />
		</xs:sequence>
		<xs:attribute type="xs:short" name="id" use="required" />
		<xs:attribute type="xs:short" name="reward_id" />
		<xs:attribute type="xs:string" name="name" />
		<xs:attribute type="xs:int" name="requiredCompletion" use="required" />
		<xs:attribute type="xs:boolean" name="dailyReset" />
		<xs:attribute type="xs:boolean" name="isOneTime" />
		<xs:attribute type="xs:boolean" name="isMainClassOnly" />
		<xs:attribute type="xs:boolean" name="isDualClassOnly" />
		<xs:attribute type="xs:boolean" name="isDisplayedWhenNotAvailable" />
		<xs:attribute type="xs:string" name="duration" />
	</xs:complexType>
	<xs:complexType name="listType">
		<xs:sequence>
			<xs:element type="rewardType" name="reward" maxOccurs="unbounded" minOccurs="0" />
		</xs:sequence>
	</xs:complexType>
</xs:schema>
